{
  "version": 1,
  "resolvedInputText": "Der Bundesrat unterschrieb den EU-Vertrag rechtskräftig bevor Volk und Parlament darüber entschieden haben",
  "preparedUnderstanding": {
    "detectedInputType": "text",
    "impliedClaim": "Der Bundesrat unterschrieb den EU-Vertrag rechtskräftig bevor Volk und Parlament darüber entschieden haben",
    "backgroundDetails": "Structural compatibility fixture only.",
    "articleThesis": "Der Bundesrat unterschrieb den EU-Vertrag rechtskräftig bevor Volk und Parlament darüber entschieden haben",
    "atomicClaims": [
      {
        "id": "AC_01",
        "statement": "Der Bundesrat unterschrieb den EU-Vertrag rechtskräftig bevor Volk und Parlament darüber entschieden haben",
        "category": "factual",
        "centrality": "high",
        "harmPotential": "medium",
        "isCentral": true,
        "claimDirection": "supports_thesis",
        "thesisRelevance": "direct",
        "keyEntities": [],
        "checkWorthiness": "high",
        "specificityScore": 0.8,
        "groundingQuality": "strong",
        "expectedEvidenceProfile": {
          "methodologies": [],
          "expectedMetrics": [],
          "expectedSourceTypes": []
        }
      }
    ],
    "distinctEvents": [],
    "riskTier": "B",
    "detectedLanguage": "de",
    "inferredGeography": "CH",
    "preliminaryEvidence": [],
    "gate1Stats": {
      "totalClaims": 1,
      "passedOpinion": 1,
      "passedSpecificity": 1,
      "passedFidelity": 1,
      "filteredCount": 0,
      "overallPass": true
    },
    "contractValidationSummary": {
      "ran": true,
      "preservesContract": true,
      "rePromptRequired": false,
      "summary": "Structural fixture: selected claim preserves the prepared statement.",
      "stageAttribution": "initial",
      "truthConditionAnchor": {
        "presentInInput": true,
        "anchorText": "rechtskräftig bevor Volk und Parlament darüber entschieden haben",
        "preservedInClaimIds": [
          "AC_01"
        ],
        "validPreservedIds": [
          "AC_01"
        ]
      }
    }
  },
  "preparationProvenance": {
    "pipelineVariant": "claimboundary",
    "sourceInputType": "text",
    "resolvedInputSha256": "fixture-sha256",
    "executedWebGitCommitHash": "fixture-commit",
    "promptContentHash": "fixture-prompt-hash",
    "pipelineConfigHash": "fixture-pipeline-config",
    "searchConfigHash": "fixture-search-config",
    "calcConfigHash": "fixture-calc-config",
    "selectionCap": 5,
    "selectionAdmissionCap": 5
  }
}
